{
  "$schema": "./schema.json",
  "manifest_version": 1,
  "target": {
    "product": "OpenSCAD",
    "core_baseline": "2021.01",
    "oracle_version": "2024.12.17",
    "audited_at": "2026-08-09",
    "policy": "Clean-room classification from public documentation, black-box oracle output, and OpenRSCAD's public implementation/tests; verified does not imply exhaustive input coverage."
  },
  "hosts": {
    "cli": "Native command-line renderer",
    "desktop": "Tauri desktop application",
    "web": "Browser playground",
    "wasm": "Direct WebAssembly API",
    "npm": "Node/browser npm package",
    "lsp": "Language server render and analysis paths"
  },
  "sources": [
    {
      "id": "manual:cheatsheet-2021.01",
      "description": "Official OpenSCAD v2021.01 cheat sheet",
      "url": "https://openscad.org/cheatsheet/"
    },
    {
      "id": "manual:user-manual",
      "description": "Public OpenSCAD user manual",
      "url": "https://en.wikibooks.org/wiki/OpenSCAD_User_Manual"
    },
    {
      "id": "audit:track-f",
      "description": "Measured compatibility audit and execution plan",
      "path": "docs/roadmap/track-f-measured-openscad-compatibility.md"
    },
    {
      "id": "audit:divergence-register",
      "description": "Confirmed compatibility divergence register",
      "path": "COMPAT.md"
    }
  ],
  "features": [
    { "id": "syntax.assignment", "category": "syntax", "surface": "name = expression;", "tier": "core_2021_01", "status": "verified", "hosts": ["cli", "desktop", "web", "wasm", "npm", "lsp"], "summary": "Assignments, last-write-wins hoisting, dead RHS suppression, and no-forward-reference behavior match the oracle cases.", "tests": ["echo:assign_hoist"] },
    { "id": "syntax.conditional.ternary", "category": "syntax", "surface": "condition ? then : else", "tier": "core_2021_01", "status": "verified", "hosts": ["cli", "desktop", "web", "wasm", "npm", "lsp"], "summary": "Conditional expressions and nesting are oracle-covered.", "tests": ["echo:ternary_let", "echo:darkcorners"] },
    { "id": "syntax.module.definition_call", "category": "syntax", "surface": "module name(params) body; name(args);", "tier": "core_2021_01", "status": "verified", "hosts": ["cli", "desktop", "web", "wasm", "npm", "lsp"], "summary": "User module definition, lexical lookup, and invocation are exercised through observable echoes.", "tests": ["echo:scoping", "echo:children"] },
    { "id": "syntax.function.definition_call", "category": "syntax", "surface": "function name(params) = expression; name(args)", "tier": "core_2021_01", "status": "verified", "hosts": ["cli", "desktop", "web", "wasm", "npm", "lsp"], "summary": "Named functions, recursion, mutual recursion, and calls are oracle-covered.", "tests": ["echo:recursion", "echo:advanced"] },
    { "id": "syntax.function.literal", "category": "syntax", "surface": "function(params) expression", "tier": "core_2021_01", "status": "verified", "hosts": ["cli", "desktop", "web", "wasm", "npm", "lsp"], "summary": "Function literals and calls through function values are oracle-covered.", "tests": ["echo:functions"] },
    { "id": "syntax.arguments.named_positional", "category": "syntax", "surface": "call(positional, name=value)", "tier": "core_2021_01", "status": "implemented", "hosts": ["cli", "desktop", "web", "wasm", "npm", "lsp"], "summary": "Generic named and positional binding is implemented; only selected builtin signatures have direct oracle cases." },
    { "id": "syntax.arguments.special_variable_scope", "category": "syntax", "surface": "call($fn=..., ...) children", "tier": "core_2021_01", "status": "verified", "hosts": ["cli", "desktop", "web", "wasm", "npm", "lsp"], "summary": "A $-prefixed argument is dynamically scoped over the callee and everything under it, for builtin modules, user modules and their children(), and function calls; each argument expression evaluates once in the caller's scope and does not leak past the call.", "tests": ["echo:special_args", "geom:special_args_fn"] },    { "id": "syntax.arguments.defaults", "category": "syntax", "surface": "function/module parameter defaults", "tier": "core_2021_01", "status": "verified", "hosts": ["cli", "desktop", "web", "wasm", "npm", "lsp"], "summary": "Omitted function and module defaults are lazy and use the definition's ordinary lexical environment, while special variables remain dynamic and explicit arguments use caller scope; these paths are oracle-covered.", "tests": ["echo:functions"] },
    { "id": "syntax.scope.lexical", "category": "syntax", "surface": "ordinary variable/function/module lexical scope", "tier": "core_2021_01", "status": "verified", "hosts": ["cli", "desktop", "web", "wasm", "npm", "lsp"], "summary": "Ordinary bindings and closures use lexical scope.", "tests": ["echo:scoping"] },
    { "id": "syntax.scope.special_dynamic", "category": "syntax", "surface": "$-prefixed dynamic scope", "tier": "core_2021_01", "status": "verified", "hosts": ["cli", "desktop", "web", "wasm", "npm", "lsp"], "summary": "Special variables follow the dynamic call chain.", "tests": ["echo:scoping"] },
    { "id": "syntax.statement.if_else", "category": "syntax", "surface": "if (condition) body else body", "tier": "core_2021_01", "status": "implemented", "hosts": ["cli", "desktop", "web", "wasm", "npm", "lsp"], "summary": "Statement-level conditional branching is parsed and evaluated; upstream diagnostic and edge parity are not inventoried." },
    { "id": "syntax.statement.for", "category": "syntax", "surface": "for (name=range/list, ...) body", "tier": "core_2021_01", "status": "implemented", "hosts": ["cli", "desktop", "web", "wasm", "npm", "lsp"], "summary": "Range/list and Cartesian statement iteration are implemented; exhaustive oracle coverage is pending." },
    { "id": "syntax.statement.let", "category": "syntax", "surface": "let (bindings) body", "tier": "core_2021_01", "status": "implemented", "hosts": ["cli", "desktop", "web", "wasm", "npm", "lsp"], "summary": "Statement-level lexical bindings are implemented." },
    { "id": "syntax.expression.let", "category": "syntax", "surface": "let (bindings) expression", "tier": "core_2021_01", "status": "verified", "hosts": ["cli", "desktop", "web", "wasm", "npm", "lsp"], "summary": "Sequential let bindings and shadowing are oracle-covered.", "tests": ["echo:ternary_let", "echo:advanced"] },
    { "id": "syntax.comprehension.for", "category": "syntax", "surface": "[for (bindings) expression]", "tier": "core_2021_01", "status": "verified", "hosts": ["cli", "desktop", "web", "wasm", "npm", "lsp"], "summary": "Range and Cartesian list generation are oracle-covered.", "tests": ["echo:comprehension"] },
    { "id": "syntax.comprehension.c_for", "category": "syntax", "surface": "[for (init; condition; update) expression]", "tier": "core_2021_01", "status": "verified", "hosts": ["cli", "desktop", "web", "wasm", "npm", "lsp"], "summary": "C-style accumulator comprehensions are oracle-covered.", "tests": ["echo:cfor"] },
    { "id": "syntax.comprehension.each", "category": "syntax", "surface": "[each expression]", "tier": "core_2021_01", "status": "verified", "hosts": ["cli", "desktop", "web", "wasm", "npm", "lsp"], "summary": "List flattening, including conditional operands, is oracle-covered.", "tests": ["echo:comprehension", "echo:sideeffects"] },
    { "id": "syntax.comprehension.if_else", "category": "syntax", "surface": "[if (condition) then else alternative]", "tier": "core_2021_01", "status": "verified", "hosts": ["cli", "desktop", "web", "wasm", "npm", "lsp"], "summary": "Conditional list elements are oracle-covered.", "tests": ["echo:comprehension"] },
    { "id": "syntax.comprehension.let", "category": "syntax", "surface": "[let (bindings) expression]", "tier": "core_2021_01", "status": "verified", "hosts": ["cli", "desktop", "web", "wasm", "npm", "lsp"], "summary": "Comprehension-local bindings are oracle-covered.", "tests": ["echo:comprehension", "echo:advanced"] },
    { "id": "syntax.block", "category": "syntax", "surface": "{ statements }", "tier": "core_2021_01", "status": "implemented", "hosts": ["cli", "desktop", "web", "wasm", "npm", "lsp"], "summary": "Bare and child blocks are parsed and scoped." },
    { "id": "syntax.expression.echo", "category": "syntax", "surface": "echo(args) expression", "tier": "core_2021_01", "status": "verified", "hosts": ["cli", "desktop", "web", "wasm", "npm", "lsp"], "summary": "Expression-prefix echo returns its body and preserves side-effect order.", "tests": ["echo:sideeffects"] },
    { "id": "syntax.expression.assert", "category": "syntax", "surface": "assert(condition, message) expression", "tier": "core_2021_01", "status": "verified", "hosts": ["cli", "desktop", "web", "wasm", "npm", "lsp"], "summary": "Expression-prefix assertions and short-circuit suppression are oracle-covered.", "tests": ["echo:sideeffects"] },
    { "id": "syntax.modifier.disable", "category": "syntax", "surface": "*module_call", "tier": "core_2021_01", "status": "implemented", "hosts": ["cli", "desktop", "web", "wasm", "npm", "lsp"], "summary": "Disabled subtrees are omitted." },
    { "id": "syntax.modifier.root", "category": "syntax", "surface": "!module_call", "tier": "core_2021_01", "status": "implemented", "hosts": ["cli", "desktop", "web", "wasm", "npm", "lsp"], "summary": "The last root-modified subtree becomes the rendered root." },
    { "id": "syntax.modifier.highlight", "category": "syntax", "surface": "#module_call", "tier": "core_2021_01", "status": "implemented", "hosts": ["cli", "desktop", "web", "wasm", "npm", "lsp"], "summary": "Highlight metadata is retained for preview and included in exact geometry." },
    { "id": "syntax.modifier.background", "category": "syntax", "surface": "%module_call", "tier": "core_2021_01", "status": "implemented", "hosts": ["cli", "desktop", "web", "wasm", "npm", "lsp"], "summary": "Background metadata is previewed and excluded from fused exports." },